Index,Keyword,Tweets
0,3 idiots,This idiots among
1,3 idiots,Or least case TLJ audiences idiots n't appreciate -dimensional takes chara
2,3 idiots,When deal Idiots results Remember DemoRats much cheer last year
3,3 idiots,I hear There perception right-wing science-denying idiots I arrested
4,3 idiots,Do n't let people like get Dad 3 're idiots n't deserve precious time
5,3 idiots,Indians Idiots seeked foreign interferences
6,3 idiots,
7,3 idiots,idiots straight outta compton real quick
8,3 idiots,Mary Christmas us idiots // Bite Size Theology Extended Edition No.21 Merry Christmas Edition
9,3 idiots,Mary Christmas us idiots // Bite Size Theology Extended Edition No.21 Merry Christmas Edition
10,3 idiots,Where idiots Khans conscious awake already secure citizenship like Akshay
11,3 idiots,Microsoft Xbox exec meeting Idiot We smashed tune console actual exclusives Idio
12,3 idiots,The intellectual dwarfs amp categories people tweet/retweets wanted TL Crusaders Follower
13,3 idiots,years tories created fukin mess couldnae sort .. youve given em free hand .to whatever li
14,3 idiots,The Democrats corrupt immoral people right run country Bi
15,3 idiots,The intellectual dwarfs amp categories people tweet/retweets wanted TL Crusaders Follower
16,3 idiots,Shiff Nadler rehearsing years All seem rely
17,3 idiots,Yes Idiots vulgar film well Pissing outside Principal house using vacuum cleaner etc
18,3 idiots,I wish idiots scene real ...
19,3 idiots,A pessimist sees dark tunnel An optimist sees light end tunnel realist sees freight train T
20,3 idiots,It actually amazes many people think Impeachment means trump longer president.. He removed f
21,3 idiots,Indians Idiots seeked foreign interferences
22,3 idiots,Indians Idiots seeked foreign interferences
23,3 idiots,The Labour party bigger MPs .It powerful movement Yes idiots moment w
24,3 idiots,Indians Idiots seeked foreign interferences
25,3 idiots,According kind Rajma sarkaar 's precious bhakts People protesting idiots UN also w
26,3 idiots,Indians Idiots seeked foreign interferences
27,3 idiots,Indians Idiots seeked foreign interferences
28,3 idiots,Indians Idiots seeked foreign interferences
29,3 idiots,Till date asim never nominated fir bhi idiots saying back stabbed
30,3 idiots,Indians Idiots seeked foreign interferences
31,3 idiots,Forget I present Gypsy legged reindeer Yes owners idiots love
32,3 idiots,Indians Idiots seeked foreign interferences
33,3 idiots,idiots Mi India u promised -4 days delivery order still movement Any
34,3 idiots,idiots dreams
35,3 idiots,Abe ye idiots wala wo chu*** h jao firse project banake Lao
36,3 idiots,medical students ... .all trying talk someone asleep like idiots
37,3 idiots,Have I mentioned much I hate idiots post weeks I hrs shift
38,3 idiots,Nothing keeps going like movie I always watch remind I best
39,3 idiots,Indians Idiots seeked foreign interferences
40,3 idiots,Indians Idiots seeked foreign interferences
41,3 idiots,Indians Idiots seeked foreign interferences
42,3 idiots,All well I cant believe I watched idiots What masterpiece Idiot
43,3 idiots,Indians Idiots seeked foreign interferences
44,3 idiots,Indians Idiots seeked foreign interferences
45,3 idiots,Indians Idiots seeked foreign interferences
46,3 idiots,I leave quote Ranchoddas Shamaldas Chanchad Idiots gem Hindi movie
47,3 idiots,Something give yet English working class fell card trick daughters
48,3 idiots,Negative people Trend Negative things .. IGNORE THEM They idiots like idol We spread
49,3 idiots,After idiots film speaks strongly important education subject
